{
  "id": "6eb8b388-5f18-4a19-a9b0-c85de554694e-r2",
  "run_id": "6eb8b388-5f18-4a19-a9b0-c85de554694e",
  "state": {
    "run_id": "6eb8b388-5f18-4a19-a9b0-c85de554694e",
    "session_id": "S-daemon",
    "turn_id": "turn-1",
    "phase": "checkpoint",
    "revision": 2,
    "context_manifest_id": "ctx-6eb8b388-5f18-4a19-a9b0-c85de554694e",
    "stop_reason": "completed",
    "updated_at": "2026-09-17T14:13:46.14299757Z"
  },
  "created_at": "2026-09-17T14:13:46.143000251Z"
}